<?xml version="1.0" encoding="UTF-8"?>
<!DOCTYPE list SYSTEM "skill.dtd">
<list>
	<skill id="18814" levels="6" name="Topaz">
		<table name="#icon">icon.etc_bm_jewel_topaz_i00 icon.etc_bm_jewel_topaz_i00 icon.etc_bm_jewel_topaz_i00 icon.etc_bm_jewel_topaz_i00 icon.etc_bm_jewel_topaz_i00 icon.bm_jewel_absdmg_high_lv1_lavianrose</table>
		<set name="icon" value="#icon"/>
		<set name="target" value="TARGET_NONE"/>
		<set name="skillType" value="NOTUSED"/>
		<set name="operate_type" value="P"/>
	</skill>
	<skill id="18815" levels="6" name="Tanzanite">
		<table name="#icon">icon.etc_bm_jewel_tanzanite icon.etc_bm_jewel_tanzanite icon.etc_bm_jewel_tanzanite icon.etc_bm_jewel_tanzanite icon.etc_bm_jewel_tanzanite icon.bm_jewel_tanzanite_high_lv1_lavianrose</table>
		<set name="icon" value="#icon"/>
		<set name="target" value="TARGET_NONE"/>
		<set name="skillType" value="NOTUSED"/>
		<set name="operate_type" value="P"/>
	</skill>
</list>