<?xml version="1.0" encoding="UTF-8"?>
<!DOCTYPE list SYSTEM "skill.dtd">
<list>
	<skill id="11496" levels="2" name="Summoner Boss Penalty">
		<set name="icon" value="icon.skill0217"/>
		<set name="target" value="TARGET_NONE"/>
		<set name="skillType" value="NOTDONE"/>
		<set name="operate_type" value="A2"/>
	</skill>
	<skill id="11497" levels="1" name="Summoner - Individual Passive">
		<set name="icon" value="icon.skill0217"/>
		<set name="magicLevel" value="85"/>
		<set name="target" value="TARGET_NONE"/>
		<set name="skillType" value="NOTDONE"/>
		<set name="operate_type" value="A2"/>
	</skill>
	<skill id="11498" levels="1" name="Summoner - Individual">
		<set name="icon" value="icon.skill1543"/>
		<set name="reuseDelay" value="5000"/>
		<set name="hitTime" value="500"/>
		<set name="abnormal_time" value="5"/>
		<set name="abnormal_level" value="1"/>
		<set name="abnormal_type" value="summon_condition"/>
		<set name="magicLevel" value="85"/>
		<set name="magicType" value="ITEM"/>
		<!--
		Предположительно яраость пета и тригес скила виликое владение призывом	Уровень: 1; Описание: В течение 5 сек. увеличивает Физ. Атк., Маг. Атк., шанс Крит. Атк., силу Крит. Атк. на 10%.
		-->
		<set name="target" value="TARGET_ONE_SERVITOR"/>
		<set name="skillType" value="BUFF"/>
		<set name="operate_type" value="A2"/>
		<for>
			<effect>
				<mul stat="pAtk" value="1.1"/>
				<mul stat="mAtk" value="1.1"/>
				<add stat="pCritRate" value="10"/>
				<add stat="p_critical_damage_per" value="10"/>
			</effect>
		</for>
	</skill>
	<skill id="11499" levels="1" name="Heavy Hit">
		<set name="icon" value="icon.skill10317"/>
		<set name="reuseDelay" value="10000"/>
		<set name="coolTime" value="300"/>
		<set name="castRange" value="900"/>
		<set name="hitTime" value="2000"/>
		<set name="mp_consume" value="71"/>
		<set name="magicLevel" value="85"/>
		<set name="magicType" value="MAGIC"/>
		<set name="power" value="5000"/>
		<set name="target" value="TARGET_ONE"/>
		<set name="skillType" value="PDAM"/>
		<set name="operate_type" value="A2"/>
	</skill>
</list>