<?xml version="1.0" encoding="UTF-8"?>
<!DOCTYPE list SYSTEM "skill.dtd">
<list>
	<skill id="46800" levels="6" name="Sayha\'s Ring">
		<set name="icon" value="BranchIcon.Icon.ring_of_sayhas_i00"/>
		<set name="reuseDelay" value="1000"/>
		<set name="hitTime" value="500"/>
		<set name="target" value="TARGET_NONE"/>
		<set name="skillType" value="NOTUSED"/>
		<set name="operate_type" value="P"/>
	</skill>
	<skill id="46801" levels="6" name="Maphr\'s Ring">
		<set name="icon" value="BranchIcon.Icon.ring_of_maphr_i00"/>
		<set name="reuseDelay" value="1000"/>
		<set name="target" value="TARGET_NONE"/>
		<set name="skillType" value="NOTUSED"/>
		<set name="operate_type" value="P"/>
	</skill>
	<skill id="46802" levels="6" name="Maphr\'s Ring">
		<set name="icon" value="BranchIcon.Icon.ring_of_maphr_i00"/>
		<set name="reuseDelay" value="1000"/>
		<set name="hitTime" value="500"/>
		<set name="target" value="TARGET_NONE"/>
		<set name="skillType" value="NOTUSED"/>
		<set name="operate_type" value="P"/>
	</skill>
</list>